Concept,Category,Description,Surah,Verse,Translation,Relation to Concept
Anima and animus,Psychoanalytic Psychology,"According to Jung, these are the male and female archetypes residing in the unconscious of individuals, respectively. The anima exemplifies the feminine principle in men, while the animus signifies the masculine principle in women.",An-Najm (The Star),45,"And that it is He who created the two mates, the male and the female,",Related to psychological concept
Archetypes,Psychoanalytic Psychology,"In Jungian psychology, these represent universal, primal, and collective mental representations inherited from our earliest ancestors. They are prevalent in literature, art, and religious iconography across cultures and serve to channel experiences and emotions, resulting in recognizable behavior patterns.",Al-Araf,7,"And [mention] when your Lord took from the children of Adam - from their loins - their descendants and made them testify of themselves, [saying to them], 'Am I not your Lord?' They said, 'Yes, we have testified.' [This] - lest you should say on the Day of Resurrection, 'Indeed, we were of this unaware.'",Related to psychological concept
Collective unconscious,Psychoanalytic Psychology,"A term coined by Carl Jung, it posits the existence of a shared part of the unconscious mind among all humans, deriving from ancestral memory. It’s believed to contain archetypes, universal images, patterns, and instincts inherent in all of us.",,,,
Countertransference,Psychoanalytic Psychology,"This refers to a therapist’s emotions and responses to a client, which can stem from the therapist’s own personal history. It’s typically considered as hindrance to therapy but can provide insight into the dynamics of the therapeutic relationship.",,,,
Death drive (Thanatos),Psychoanalytic Psychology,This is a compelling concept from Freud that suggests humans possess an inherent drive towards death and self-destruction. It counterbalances Eros (the life drive) and is often associated with aggressive behaviors.,Al-Imran,3,"Every soul will taste death, and you will only be given your full compensation on the Day of Resurrection. So he who is drawn away from the Fire and admitted to Paradise has attained [his desire]. And what is the life of this world except the enjoyment of delusion.",Related to psychological concept
Defense mechanisms,Psychoanalytic Psychology,These are strategies employed by the ego to mediate the conflict between the id and superego. They are unconscious mental processes that guard the individual from anxiety or unacceptable thoughts and feelings.,Al-A'raf,7,"And if an evil suggestion comes to you from Satan, then seek refuge in Allah. Indeed, He is Hearing and Knowing.",Related to psychological concept
Displacement,Psychoanalytic Psychology,This defense mechanism in psychoanalysis involves shifting of impulses from an unacceptable target to a safer or more acceptable one. An example is redirecting aggression from a boss to a less-threatening loved one.,An-Nisa (Chapter 4),116,"Indeed, Allah does not forgive association with Him, but He forgives what is less than that for whom He wills. And he who associates others with Allah has certainly fabricated a tremendous sin.",Related to psychological concept
Dream analysis,Psychoanalytic Psychology,"This is a key technique in psychoanalysis that interprets dreams to unearth unconscious desires or concerns. Freud viewed dreams as ‘the royal road to the subconscious,’ conveying unspeakable desires.",Al-An'am,6,"And they swear by Allah their strongest oaths that Allah will not raise up him who dies. Yes, it is a promise binding upon Him in truth, but most of mankind do not know.",Related to psychological concept
Electra complex,Psychoanalytic Psychology,"This concept, proposed by Carl Jung, is the female counterpart of the Oedipus complex. It entails a girl’s psychosexual competition with her mother for her father’s attraction.",,,,
Erikson’s stages of psychosocial development,Psychoanalytic Psychology,"This proposes a lifespan model of development, comprising eight stages from infancy to late adulthood. Every stage presents a crisis deriving from a conflict between personal impulse and the social world, resolution of which leads to competence in a specific area of life.",Al-Imran  ,3,"O you who have believed, fear Allah as He should be feared and do not die except as Muslims [in submission to Him].",Related to psychological concept
Extraversion,Psychoanalytic Psychology,"A term representing one pole of a personality dimension, extraversion is characterized by sociability, assertiveness, and a preference for company. Extraverts are energized by social interaction.",,,,
Free association,Psychoanalytic Psychology,"A method employed during psychoanalysis, it involves the patient speaking freely about memories, dreams, or thoughts. It’s a tool that helps uncover repressed feelings and experiences.",Al-Anam,6,And with Him are the keys of the unseen; none knows them except Him. And He knows what is on the land and in the sea. Not a leaf falls but that He knows it. And no grain is there within the darknesses of the earth and no moist or dry [thing] but that it is [written] in a clear record.,Related to psychological concept
Freudian slip,Psychoanalytic Psychology,"This is an unintentional error — verbal or memory — which unveils repressed feelings or thoughts. According to Freudian theory, these slips hint at the workings of the subconscious mind.",Al-Mujadila,58,"Do you not see that Allah knows whatever is in the heavens and whatever is on the earth? There is no secret counsel of three but He is their fourth, nor of five but He is their sixth, nor fewer nor more, but He is with them wherever they may be; and thereafter, on the Day of Resurrection, He will inform them of what they did. Surely, Allah knows all things full well.",Related to psychological concept
"Id, ego, and superego",Psychoanalytic Psychology,"These are the three agents comprising the psychic apparatus defined by Freud. The Id is driven by primitive desires, the ego moderates between desires and reality, and the superego acts as the moral compass.",Al-A'raf  ,7,"And if an evil suggestion comes to you from Satan, then seek refuge in Allah. Indeed, He is Hearing and Knowing.",Related to psychological concept
Introversion,Psychoanalytic Psychology,"The opposing trait to extraversion in personality psychology, introversion involves drawing energy from one’s internal world of thoughts, feelings, and ideas. Introverts tend to prefer solitude, intimate interactions over large gatherings, and often engage in introspective activities.",Al-An'am,63,"Indeed, hearts find rest in the remembrance of Allah.",Related to psychological concept
Libido,Psychoanalytic Psychology,"In psychoanalytic theory, this term defines the sexual energy or force. Apart from strict sexual desire, this also extends to creative or productive drives in general.",Ar-Rum,30,And of His signs is that He created for you from yourselves mates that you may find tranquility in them; and He placed between you affection and mercy. Indeed in that are signs for a people who give thought.,Related to psychological concept
Object relations,Psychoanalytic Psychology,"This refers to interpersonal relations, emphasizing the internalization of experiences with significant others, particularly primary caretakers during early life. The term originates from psychoanalytic theory where “object” refers to the target of one’s drives and “relations” refers to interpersonal relationships.",,,,
Oedipus complex,Psychoanalytic Psychology,"This is a term from psychoanalytic theory, stating a child’s feelings of desire towards their opposite-sex parent and rivalry with their same-sex parent. Coined by Sigmund Freud, it’s considered a crucial stage in the formation of an individual’s sexual and social identities.",Al-Baqarah,2,There shall be no compulsion in [acceptance of] the religion. The right course has become clear from the wrong. So whoever disbelieves in false deities and believes in Allah has grasped the most trustworthy handhold with no break in it. And Allah is Hearing and Knowing.,Related to psychological concept
Pleasure principle,Psychoanalytic Psychology,"This Freudian concept is the governing force of the id, striving for immediate satisfaction of all wants, needs, and urges. Essentially, the urge to reduce tension by fulfilling desires characterizes human nature according to the pleasure principle.",,,,
Projection,Psychoanalytic Psychology,"As a psychological defense mechanism, projection involves attributing thoughts, feelings, or motives that are unacceptable or unwanted in oneself to someone else. Essentially, the individual “projects” undesired aspects onto others as a means of avoidance.",Al-Baqarah,2,Allah does not burden a soul beyond that it can bear ...,Related to psychological concept
Reality principle,Psychoanalytic Psychology,"This concept, contrasting with the pleasure principle, is managed by the ego and seeks to satisfy the id’s desires realistically and in a socially appropriate manner. It nudges an understanding of the real world and adjusts actions accordingly.",Al-Baqarah,2,"And take provisions, but indeed, the best provision is Taqwa (piety, righteousness). So fear Me, O you of understanding.",Related to psychological concept
Repression,Psychoanalytic Psychology,"This defense mechanism involves burying distressful or unpleasant memories deep into the subconscious mind. It provides an escape from pain but can trigger anxiety, guilt, etc., indirectly influencing feelings and behaviors.",Al-Baqarah,2,"Then do you believe in a part of the Scripture and reject the rest? But what is the recompense for those who do that among you except disgrace in worldly life; and on the Day of Resurrection, they will be sent back to the severest punishment. And Allah is not unaware of what you do.",Related to psychological concept
Shadow,Psychoanalytic Psychology,"In Jung’s psychoanalytic theory, the shadow represents the unconscious part of the personality that the conscious ego rejects or ignores. It’s often the source of negative human traits, but also consists of creativity and insight.",Surah Al-A'raf,7,"And [mention] when your Lord took from the children of Adam - from their loins - their descendants and made them testify of themselves, [saying to them], 'Am I not your Lord?' They said, 'Yes, we have testified.' [This] - lest you should say on the day of Resurrection, 'Indeed, we were of this unaware.'",Related to psychological concept
Sublimation,Psychoanalytic Psychology,This defense mechanism involves transforming unacceptable impulses or energies into socially acceptable actions or behaviors. It’s considered a mature way of dealing with inner conflict as the result is typically positive or beneficial.,,,,
Synchronicity,Psychoanalytic Psychology,This Jungian concept refers to meaningful coincidences that seemingly lack a causal connection. Jung proposed synchronicity could be an explanation for parapsychological phenomena.,An-Nahl (The Bee),16,"To Allah belongs the unseen [aspects] of the heavens and the earth. And the command for the Hour is but as a glance of the eye or it is nearer. Indeed, Allah is over all things competent.",Related to psychological concept
Transference,Psychoanalytic Psychology,"In psychoanalytic therapy, this features the redirection of feelings for a significant person to the therapist. It’s an unconscious process where the client projects feelings coming from past experiences onto the therapist.",Al-An'am,94,"And certainly you have come to Us individually as We created you the first time, and you have left behind that which We bestowed upon you. And We do not see with you your ’intercessors‘ about whom you asserted that they were Allah’s partners in respect to you. Certainly (all) the ties between you have been cut off, and that which you used to assert has failed you.",Related to psychological concept
Aversion therapy,Behavioral Psychology,"This is a behavioral treatment technique, used mainly to cease harmful habits and behaviors. It employs negative stimuli paired with the behavior to create a revulsion and thus condition the individual to avoid it.",Al-Baqarah,2,"Fighting has been enjoined upon you while it is hateful to you. But perhaps you hate a thing and it is good for you; and perhaps you love a thing and it is bad for you. And Allah knows, while you know not.",Related to psychological concept
Behavior chain,Behavioral Psychology,"This denotes a sequence of responses where each act serves both as a condition for the next and a result of the previous one. It’s a structure where one behavior leads to another, creating a ‘chain’ of actions.",Al-Baqarah,286,Allah does not burden a soul beyond that it can bear...,Related to psychological concept
Behavior modification,Behavioral Psychology,"Broadly, it’s a therapeutic approach that aims to change maladaptive behaviors through altering environmental factors, reinforcers, and consequences. It employs techniques derived from operant and classical conditioning and has its roots in behaviorism.",,,,
Classical conditioning,Behavioral Psychology,"A process envisaged by Ivan Pavlov, it involves forming an association between two stimuli. The former neutral stimulus becomes a conditioned stimulus evoking a conditioned response after repeated pairing with an unconditioned stimulus that naturally elicits an unconditioned response.",,,,
Continuous reinforcement,Behavioral Psychology,This is a reinforcement schedule where each occurrence of a specific behavior is reinforced. It’s the simplest schedule where reinforcement occurs every time the desired behavior happens.,,,,
Counterconditioning,Behavioral Psychology,"A therapeutic technique used to replace unwanted responses to stimuli with desired ones. It occurs when an individual associates something feared or avoided with positive outcomes, effectively undoing the condition.",,,,
Extinction,Behavioral Psychology,"In conditioning, this refers to the progressive decrease and disappearance of a conditioned response. Occurs when the association between the conditioned stimulus and conditioned response weakens due to absence of reinforcement.",Al-Baqarah,2,Allah does not burden a soul beyond that it can bear...,Related to psychological concept
Fixed-interval schedule,Behavioral Psychology,"This reinforcement schedule delivers reinforcement after a certain, fixed interval of time following the desired response. Here, the behavior increases as the time for potential reinforcement nears.",Al-Furqan  ,25,"And those who do not invoke with Allah another deity or kill the soul which Allah has forbidden [to be killed], except by right, and do not commit unlawful sexual intercourse. And whoever should do that will meet a penalty.",Related to psychological concept
Fixed-ratio schedule,Behavioral Psychology,This is designed to reinforce behavior after a fixed number of responses. Responding occurs at a high rate provided the number of behaviors required is not excessively high.,,,,
Habituation,Behavioral Psychology,"This instinctive learning process involves decreased response to a recurring stimulus. Essentially, organisms become ‘used to’ stimuli through repeated exposure and respond less.",,,,
Motivating operations,Behavioral Psychology,Motivating operations are environmental variables that alter the effectiveness of a reinforcer and the frequency of behaviors that have previously been reinforced by that stimulus.,Al-Ankabut  ,29,"And those who strive for Us - We will surely guide them to Our ways. And indeed, Allah is with the doers of good.",Related to psychological concept
Negative punishment,Behavioral Psychology,"A type of operant conditioning, it involves subtraction of something desirable to curtail undesired behavior. For example, taking away a favorite toy when a child misbehaves.",Yunus,64,"But when trouble toucheth man, he crieth unto Us: When We bestow a favor upon him as from Us, he saith, 'This is due to me': but when we test him, he says, 'My Lord has humiliated me!'",Related to psychological concept
Negative reinforcement,Behavioral Psychology,"This aspect of operant conditioning strengthens a behavior through removal of a negative condition. For instance, taking painkillers (behavior) to alleviate pain (negative condition).",Al-Inshirah (The Expansion),94,"For indeed, with hardship [will be] ease. Indeed, with hardship [will be] ease.",Related to psychological concept
Observational learning (modeling),Behavioral Psychology,"Albert Bandura theorized this process where individuals learn by observing others’ behavior. Modeling involves imitation, where behaviors are copied based on the perceived consequences to the model.",,,,
Operant conditioning,Behavioral Psychology,This is a learning method which manipulates the consequences of behavior as an incentive for response. It’s divided into reinforcement (strengthening behavior) and punishment (weakening behavior).,,,,
Partial (intermittent) reinforcement,Behavioral Psychology,"Here, only some responses are reinforced, making the behavior more resistant to extinction. This can occur on a variety of schedules, including the fixed and variable schedules based on ratio or interval.",Al-Kahf (The Cave),18,"And keep yourself patient [by being] with those who call upon their Lord in the morning and the evening, seeking His countenance. And let not your eyes pass beyond them, desiring adornments of the worldly life, and do not obey one whose heart We have made heedless of Our remembrance and who follows his desire and whose affair is ever [in] neglect.",Related to psychological concept
Positive punishment,Behavioral Psychology,"This aspect of operant conditioning weakens the probability of a behavior by adding an undesirable consequence. For example, an individual receives a parking fine (addition of negative element) for parking illegally (behavior).",,,,
Positive reinforcement,Behavioral Psychology,"This principle of operant conditioning strengthens a behavior by providing a positive stimulus or reward as a consequence. For instance, praise can reinforce the act of completing homework on time.",As-Saffat,40,This is indeed the supreme success.,Related to psychological concept
Premack principle,Behavioral Psychology,"An idea from behaviorism, it dictates a more preferred activity can reinforce a less preferred one. Known as “grandma’s rule” — first, you work, then you play — it encourages good behavior with the promise of a desired reward.",Al-Insan (Chapter 76),3,"Indeed, We guided him to the way, whether he be grateful or ungrateful.",Related to psychological concept
Shaping,Behavioral Psychology,"A conditioning paradigm, it gradually teaches new behaviors through reinforcement of successive approximations towards the desired outcome. Thus, it shapes behavior, bringing it closer to the desired final act.",Al-Imran,3,"Never will you attain the good [reward] until you spend [in the way of Allah] from that which you love. And whatever you spend - indeed, Allah is Knowing of it.",Related to psychological concept
Stimulus discrimination,Behavioral Psychology,"A differentiation process in learning and conditioning, it enables an individual to distinguish between similar stimuli. The organism learns to respond differently as only one of the stimuli is consistent with the conditioned response.",Al-Fatihah (The Opening),1,Guide us to the Straight Way,Related to psychological concept
Stimulus generalization,Behavioral Psychology,"Contrary to stimulus discrimination, it describes a situation where similar stimuli elicit the same response. For instance, a child conditioned to fear a specific dog may start fearing all dogs.",Al-A'raf,7,"The weakened you feared the strong. But today I shall cast fear into the hearts of the strongest of them, while the people of reason have no fear.",Related to psychological concept
Systematic desensitization,Behavioral Psychology,A behavioral therapy technique designed to reduce phobias and other abnormal fears. It entails a gradual process where individuals face the feared object or situation in a safe and controlled way until anxiety declines.,Al-Anfal,8,"And prepare against them whatever you are able of power and of steeds of war by which you may terrify the enemy of Allah and your enemy and others besides them whom you do not know but whom Allah knows. And whatever you spend in the cause of Allah will be fully repaid to you, and you will not be wronged.",Related to psychological concept
Token economy,Behavioral Psychology,"A positive reinforcement strategy in behaviour therapy, using tokens as rewards for appropriate behavior. Collected tokens can, thereafter, be exchanged for desired rewards or privileges.",,,,
Variable-interval schedule,Behavioral Psychology,"This reinforcement schedule provides reinforcement for the first response after an inconsistent period. It causes a steady, moderate rate of response, with the individual unaware of the exact timing of reinforcement.",,,,
Variable-ratio schedule,Behavioral Psychology,"This schedule reinforces behavior after a fluctuating number of responses. Typically, it leads to a high and stable rate of responding with the reinforcement always remaining uncertain.",Al-Ankabut,29,"And those who strive for Us - We will surely guide them to Our ways. And indeed, Allah is with the doers of good.",Related to psychological concept
Accommodation,Cognitive Psychology,This is a cognitive adaptation process wherein existing frameworks of understanding are adjusted to incorporate new information. It’s a part of Jean Piaget’s paradigm of cognitive development.,,,,
Anchoring and adjustment,Cognitive Psychology,"This refers to a cognitive bias where initial pieces of information are used as the reference point for future judgments. Individuals adjust their assessments from this initial ‘anchor,’ often insufficiently, hence being misled.",Al-Hujurat,49,"O you who have believed, avoid much [negative] assumption. Indeed, some assumption is sin. And do not spy or backbite each other. Would one of you like to eat the flesh of his brother when dead? You would detest it. And fear Allah; indeed, Allah is Accepting of repentance and Merciful.",Related to psychological concept
Assimilation,Cognitive Psychology,"In Piaget’s cognitive development theory, this is the process of integrating new information into existing cognitive schemas. It’s basic to learning and incorporates the novel experience within the prevailing understanding without changing the structure.",,,,
Attentional resources,Cognitive Psychology,"This theory asserts that attention is a resource distributed among tasks. Cognitive processes compete for these limited resources, hence it becomes difficult to adequately concentrate on multiple tasks simultaneously.",Al-Muddathir,74,"No! Indeed, man transgresses, because he sees himself self-sufficient.",Related to psychological concept
Bloom’s Taxonomy,Cognitive Psychology,"This is a classification of learning objectives within education proposed by Benjamin Bloom in 1956. It’s a framework for categorizing educational goals into six levels of complexity: Knowledge (Remember), Comprehension (Understand), Application (Apply), Analysis (Analyze), Synthesis (Evaluate), and Evaluation (Create). This hierarchy not only defines intellectual activities but also supports educators in creating more comprehensive lessons or tests.",Al-Baqarah,2,"He gives wisdom to whom He wills, and whoever has been given wisdom has certainly been given much good. And none will remember except those of understanding.",Related to psychological concept
Cognitive dissonance,Cognitive Psychology,"Leon Festinger’s theory proposes discomfort arises when individuals face conflicting beliefs or actions. For resolution, they either change their beliefs, acquire new ones to create coherence, or trivialize the conflict.",Al-Maida,5,"And We have revealed to you, [O Muhammad], the Book in truth, confirming that which preceded it of the Scripture and as a criterion over it. So judge between them by what Allah has revealed and do not follow their inclinations away from what has come to you of the truth.",Related to psychological concept
Cognitive load,Cognitive Psychology,"This term refers to the total mental effort being used in the working memory. It delineates the load related to a specific task, which can impede learning if it exceeds the individual’s cognitive capacity.",Al-Baqarah,286,"Allah does not charge a soul except [with that within] its capacity. It will have [the consequence of] what [good] it has gained, and it will bear [the consequence of] what [evil] it has earned...",Related to psychological concept
Cognitive map,Cognitive Psychology,This is an internal mental representation of spatially arranged elements in the world. Tolman’s theory suggests organisms have such maps which help in navigation and understanding of the environment.,,,,
Cognitive restructuring,Cognitive Psychology,"A core part of cognitive-behavioral therapy (CBT), it involves changing negative or irrational thoughts to reduce psychological discomfort. This approach helps individuals counteract cognitive distortions, often associated with mental health disorders.",,,,
